<?xml version="1.0" encoding="UTF-8"?>
<xs:schema xmlns:xs="http://www.w3.org/2001/XMLSchema">

    <xs:element name="bookstore">
        <xs:complexType>
            <xs:sequence>
                <xs:element name="book" maxOccurs="unbounded">
                    <xs:complexType>
                        <xs:sequence>
                            <xs:element name="title" type="xs:string"/>
                            <xs:element name="author" type="xs:string"/>
                            <xs:element name="publisher" type="xs:string"/>
                            <xs:element name="price" type="xs:decimal"/>
                            <xs:element name="year" type="xs:gYear"/>
                        </xs:sequence>
                        <xs:attribute name="id" type="xs:ID" use="required"/>
                        <xs:attribute name="category" type="xs:string" use="required"/>
                    </xs:complexType>
                </xs:element>
            </xs:sequence>
        </xs:complexType>
    </xs:element>

</xs:schema>